{
  "sourceKey": "kakei-marketing",
  "edition": "2015",
  "reviewedAt": "2026-09-05",
  "publicOriginalReuse": "forbidden",
  "analyses": [
    {
      "id": "kakei-marketing-2015-a00-01",
      "chapter": 0,
      "question": "学力テスト上位の県と、ほうれんそう・かれいの消費が多い県庁所在市はどこまで重なるか？",
      "thesis": "小学生の学力が高い県の県庁所在市で、特定の食品の家計消費が多いという符合を、家計調査と学力調査の組み合わせで示す論点。相関≠因果を明記して扱う。",
      "pages": [
        1,
        5
      ],
      "resolution": "combined-analysis",
      "resolutionReason": "家計調査の県庁所在市データと学力調査の都道府県データは一次資料で再取得でき、既存の食品metricで検証できる",
      "metricKeys": [
        "spinach-consumption-expenditure",
        "spinach-consumption-quantity",
        "flounder-consumption-expenditure",
        "flounder-consumption-quantity",
        "gyoza-frozen-consumption-expenditure",
        "natto-consumption-expenditure"
      ],
      "surveyIds": [
        "kakei-chousa"
      ],
      "geoScopes": [
        "prefecture-set"
      ],
      "contentRoles": [
        "ranking",
        "survey",
        "theme",
        "blog",
        "note",
        "instagram",
        "x"
      ],
      "primarySources": [
        {
          "organization": "総務省統計局",
          "publicationOrDataset": "家計調査 (二人以上の世帯・都道府県庁所在市別／年間収入五分位階級別)",
          "datasetId": "00200561",
          "url": "https://www.stat.go.jp/data/kakei/",
          "termsUrl": "https://www.digital.go.jp/resources/open_data",
          "dataYears": [
            "2012",
            "2013"
          ],
          "checkedAt": "2026-09-05",
          "rights": "allowed"
        },
        {
          "organization": "国立教育政策研究所",
          "publicationOrDataset": "全国学力・学習状況調査 (都道府県別 教科正答率)",
          "url": "https://www.nier.go.jp/kaihatsu/zenkokugakuryoku.html",
          "termsUrl": "https://www.mext.go.jp/b_menu/1351168.htm",
          "dataYears": [
            "2007",
            "2014"
          ],
          "checkedAt": "2026-09-05",
          "rights": "allowed"
        }
      ],
      "existing": {
        "blogSlugs": [
          "spinach-consumption-ranking"
        ]
      },
      "nextAction": "学力調査の47県正答率をnew-metric化した後、散布図(型B)で符合と限界を示す記事へ拡張する"
    },
    {
      "id": "kakei-marketing-2015-a01-01",
      "chapter": 1,
      "question": "公立小中学校の学力調査で継続して上位に入る県はどこか？",
      "thesis": "全国学力・学習状況調査の都道府県別平均正答率で、東北・北陸の5県が常連上位を占めるという事実。stats47には未収載。",
      "pages": [
        11,
        14
      ],
      "resolution": "new-metric",
      "resolutionReason": "国立教育政策研究所が都道府県別正答率を公開しており(政府標準利用規約)、47県値を再取得して独立指標にできる",
      "metricKeys": [],
      "surveyIds": [],
      "geoScopes": [
        "prefecture-set"
      ],
      "contentRoles": [
        "ranking",
        "survey",
        "theme",
        "blog",
        "note",
        "instagram",
        "x"
      ],
      "primarySources": [
        {
          "organization": "国立教育政策研究所",
          "publicationOrDataset": "全国学力・学習状況調査 (都道府県別 教科正答率)",
          "url": "https://www.nier.go.jp/kaihatsu/zenkokugakuryoku.html",
          "termsUrl": "https://www.mext.go.jp/b_menu/1351168.htm",
          "dataYears": [
            "2007",
            "2014"
          ],
          "checkedAt": "2026-09-05",
          "rights": "allowed"
        }
      ],
      "nextAction": "open-data-catalog `nier-gakuryoku-achievement` から小6・中3の国語/算数(数学)正答率をmetric化 (data-ingester・provenance 9点セット)"
    },
    {
      "id": "kakei-marketing-2015-a01-02",
      "chapter": 1,
      "question": "高校卒業者の大学等進学率が低い県は、教育水準が低いと言えるか？",
      "thesis": "進学率は自宅から通える大学の数や地域の就職環境に左右され、義務教育の質の指標にはならないという批判的読み方。",
      "pages": [
        15,
        17
      ],
      "resolution": "reuse-existing-metric",
      "resolutionReason": "学校基本調査由来の高等学校卒業者進学率が既存metricとして公開済み",
      "metricKeys": [
        "high-school-advancement-rate"
      ],
      "surveyIds": [
        "kakei-chousa"
      ],
      "geoScopes": [
        "prefecture-set"
      ],
      "contentRoles": [
        "ranking",
        "survey",
        "theme",
        "blog",
        "note",
        "instagram",
        "x"
      ],
      "primarySources": [
        {
          "organization": "文部科学省",
          "publicationOrDataset": "学校基本調査 (高等学校卒業後の状況)",
          "url": "https://www.mext.go.jp/b_menu/toukei/chousa01/kihon/1267995.htm",
          "termsUrl": "https://www.digital.go.jp/resources/open_data",
          "dataYears": [
            "2014"
          ],
          "checkedAt": "2026-09-05",
          "rights": "allowed"
        }
      ],
      "nextAction": "進学率ランキングのai-content/注記に『進学先の選択肢と就職環境の影響』の読み方を追加する"
    },
    {
      "id": "kakei-marketing-2015-a01-03",
      "chapter": 1,
      "question": "進学率と就職率を合算すると、堅実な進路選択ができている県はどこか？",
      "thesis": "大学等進学率と高卒就職率を足した指標で東海4県と北陸・東北が上位に来るという再評価。",
      "pages": [
        18,
        20
      ],
      "resolution": "combined-analysis",
      "resolutionReason": "既存の進学率・就職率metricを合算して再現できる",
      "metricKeys": [
        "high-school-advancement-rate",
        "high-school-new-graduates-employment-rate"
      ],
      "surveyIds": [
        "kakei-chousa"
      ],
      "geoScopes": [
        "prefecture-set"
      ],
      "contentRoles": [
        "ranking",
        "survey",
        "theme",
        "blog",
        "note",
        "instagram",
        "x"
      ],
      "primarySources": [
        {
          "organization": "文部科学省",
          "publicationOrDataset": "学校基本調査 (高等学校卒業後の状況)",
          "url": "https://www.mext.go.jp/b_menu/toukei/chousa01/kihon/1267995.htm",
          "termsUrl": "https://www.digital.go.jp/resources/open_data",
          "dataYears": [
            "2014"
          ],
          "checkedAt": "2026-09-05",
          "rights": "allowed"
        }
      ],
      "nextAction": "2指標の散布図または合算派生指標(calculated)で型B記事化。合算の妥当性(分母の一致)を先に検証する"
    },
    {
      "id": "kakei-marketing-2015-a01-04",
      "chapter": 1,
      "question": "補習教育にお金をかけずに国公立大学へ進学できている県庁所在市はどこか？",
      "thesis": "家計調査の教育費内訳(国公立/私立大学授業料・補習教育3段階)から『国公立大学授業料÷教育費』を教育投資効率とみなし、奈良型・東京型・秋田型の3パターンに整理する論点。",
      "pages": [
        21,
        31
      ],
      "resolution": "combined-analysis",
      "resolutionReason": "教育費の各内訳が家計調査由来の既存metricとして公開済みで、比率は再計算できる",
      "metricKeys": [
        "public-university-consumption-expenditure",
        "private-university-consumption-expenditure",
        "elementary-tutoring-consumption-expenditure",
        "junior-high-tutoring-consumption-expenditure",
        "high-school-tutoring-consumption-expenditure",
        "tuition-consumption-expenditure",
        "education-cost-all-households"
      ],
      "surveyIds": [
        "kakei-chousa"
      ],
      "geoScopes": [
        "prefecture-set"
      ],
      "contentRoles": [
        "ranking",
        "survey",
        "theme",
        "blog",
        "note",
        "instagram",
        "x"
      ],
      "primarySources": [
        {
          "organization": "総務省統計局",
          "publicationOrDataset": "家計調査 (二人以上の世帯・都道府県庁所在市別／年間収入五分位階級別)",
          "datasetId": "00200561",
          "url": "https://www.stat.go.jp/data/kakei/",
          "termsUrl": "https://www.digital.go.jp/resources/open_data",
          "dataYears": [
            "2012",
            "2013"
          ],
          "checkedAt": "2026-09-05",
          "rights": "allowed"
        }
      ],
      "themeSlugs": [
        "education-culture"
      ],
      "nextAction": "教育投資効率の派生指標(calculated: 国公立大学授業料/教育費)を設計し、education-culture の evidenceTopic と型D記事で展開する。家計調査の教育費は子の有無を混ぜた世帯平均である旨を注記する"
    },
    {
      "id": "kakei-marketing-2015-a01-05",
      "chapter": 1,
      "question": "年収階級によって、子どもの教育投資の中身と成果は10年でどう変わったか？",
      "thesis": "年間収入五分位階級別に教育費・補習教育・国公立/私立大学授業料の10年変化を見て、高所得層が国公立大学進学のシェアを高めたという論点。全国集計のみ。",
      "pages": [
        32,
        38
      ],
      "resolution": "combined-analysis",
      "resolutionReason": "年間収入五分位階級別の家計調査は全国集計として一次資料から再取得でき、既存記事の接地器(fetch-quintile-data)を再利用できる",
      "metricKeys": [
        "public-university-consumption-expenditure",
        "private-university-consumption-expenditure",
        "high-school-tutoring-consumption-expenditure",
        "education-cost-all-households"
      ],
      "surveyIds": [
        "kakei-chousa"
      ],
      "geoScopes": [
        "japan"
      ],
      "contentRoles": [
        "japan",
        "blog",
        "note",
        "x"
      ],
      "primarySources": [
        {
          "organization": "総務省統計局",
          "publicationOrDataset": "家計調査 (二人以上の世帯・都道府県庁所在市別／年間収入五分位階級別)",
          "datasetId": "00200561",
          "url": "https://www.stat.go.jp/data/kakei/",
          "termsUrl": "https://www.digital.go.jp/resources/open_data",
          "dataYears": [
            "2002",
            "2003",
            "2012",
            "2013"
          ],
          "checkedAt": "2026-09-05",
          "rights": "allowed"
        }
      ],
      "existing": {
        "blogSlugs": [
          "income-quintile-beverage",
          "income-quintile-alcohol",
          "income-quintile-dining"
        ]
      },
      "nextAction": "五分位×教育費の型D記事 (fetch-quintile-data.ts で2年平均を接地)。都道府県値ではないため/rankingには載せない"
    },
    {
      "id": "kakei-marketing-2015-a01-06",
      "chapter": 1,
      "question": "所得五分位の所得シェアは1990年代から2010年代でどう動いたか？",
      "thesis": "低所得層の所得シェアが半減し高所得層へ移った、という格差拡大の背景説明。",
      "pages": [
        39,
        42
      ],
      "resolution": "context-only",
      "resolutionReason": "家計調査の年間収入五分位別データで背景として確認できるが、独立指標にはしない",
      "metricKeys": [],
      "surveyIds": [],
      "geoScopes": [
        "japan"
      ],
      "contentRoles": [
        "blog",
        "note",
        "x"
      ],
      "primarySources": [
        {
          "organization": "総務省統計局",
          "publicationOrDataset": "家計調査 (二人以上の世帯・都道府県庁所在市別／年間収入五分位階級別)",
          "datasetId": "00200561",
          "url": "https://www.stat.go.jp/data/kakei/",
          "termsUrl": "https://www.digital.go.jp/resources/open_data",
          "dataYears": [
            "1993",
            "2011"
          ],